{
  "spec_id": "SPEC-0063",
  "generated_at": "2026-09-27T12:59:05Z",
  "new_contracts": [
    "CON-0225",
    "CON-0226"
  ],
  "conflicts": [
    {
      "id": "CF-0063-001",
      "type": "dependency-gap",
      "severity": "medium",
      "new_contract": "CON-0225",
      "conflicting_contract": "CON-0121",
      "detail": "INV-02 von CON-0225 zählt die Usage eines Runs über `token_usage.run_id`. Das kanonische token_usage-Schema (CON-0121, erweitert durch CON-0129) kennt aber keine Spalte `run_id`. Der Code hat sie bereits (`tool/sdd_cli/llm/usage_table.py:23`), kein Daten-Contract beschreibt sie. Das Budget hängt also an einem Feld, das kein Contract garantiert. Lösung: `run_id` (und bei Bedarf die Rollenzuordnung) per Schema-Erweiterung in CON-0121 oder CON-0129 aufnehmen.",
      "affected_specs": [],
      "required_action": "",
      "status": "resolved",
      "resolution": {
        "action": "CON-0225 INV-02 verweist auf CON-0206 (Spalte run_id).",
        "resolved_at": "2026-09-27T13:01:18Z"
      }
    },
    {
      "id": "CF-0063-002",
      "type": "dependency-gap",
      "severity": "low",
      "new_contract": "CON-0225",
      "conflicting_contract": "CON-0129",
      "detail": "INV-02 bestimmt Claude-Tokens über die Provider-Belegung der Rolle in `run.json`, nicht über die `model`- und `agent_type`-Felder, die CON-0129 in token_usage festschreibt. Damit gibt es zwei Quellen für die Zuordnung. Ändert sich die Rollenbelegung zwischen Rollenaufrufen oder weicht sie vom geloggten Modell ab, landen Zeilen im falschen Budget. Den Join-Schlüssel zwischen token_usage-Zeile und Rolle ausdrücklich festlegen.",
      "affected_specs": [],
      "required_action": "",
      "status": "acknowledged",
      "resolution": {
        "action": "acknowledged",
        "reason": "Die Belegung eines Runs steht in run.json fest (CON-0202) und ändert sich im Run nicht; sie ist die Quelle für den Provider.",
        "resolved_at": "2026-09-27T13:01:18Z"
      }
    },
    {
      "id": "CF-0063-003",
      "type": "field-contradiction",
      "severity": "medium",
      "new_contract": "CON-0225",
      "conflicting_contract": "CON-0030",
      "detail": "INV-03 setzt `state.status` auf `halted` und schreibt ein Ereignis `transition` mit Grund `budget` und Zählstand. Das Pipeline-Phase-State-Schema (CON-0030) enthält weder den Status `halted` noch ein Feld für Halt-Grund oder Zählstand. Ist das Schema geschlossen (enum/additionalProperties), sind budget-gehaltene Runs schemawidrig. CON-0030 erweitern oder das zuständige Run-State-Schema nennen.",
      "affected_specs": [],
      "required_action": "",
      "status": "acknowledged",
      "resolution": {
        "action": "acknowledged",
        "reason": "halted gehört zum Run-Zustand nach CON-0202 (state.json), nicht zu den Gate-Phasen aus CON-0030.",
        "resolved_at": "2026-09-27T13:01:19Z"
      }
    },
    {
      "id": "CF-0063-004",
      "type": "dependency-gap",
      "severity": "medium",
      "new_contract": "CON-0225",
      "conflicting_contract": "CON-0016",
      "detail": "INV-01 und INV-04 führen die neuen Config-Keys `pipeline.budget.max_tokens` und `pipeline.budget.max_claude_tokens` ein, dazu eine Validierung durch `sdd config validate`. Der config.yaml-Schema-Contract (CON-0016) und die Validierungs-Contracts (CON-0190/CON-0191, siehe nächste Einträge) beschreiben diese Keys und die Regel ›ganze Zahl > 0‹ nicht.",
      "affected_specs": [],
      "required_action": "",
      "status": "resolved",
      "resolution": {
        "action": "CON-0225 INV-04: Budget-Regel ergänzt die Config-Prüfung additiv; pipeline.budget ist neuer Abschnitt.",
        "resolved_at": "2026-09-27T13:01:20Z"
      }
    },
    {
      "id": "CF-0063-005",
      "type": "dependency-gap",
      "severity": "low",
      "new_contract": "CON-0225",
      "conflicting_contract": "CON-0190",
      "detail": "INV-04 macht ein Budget ≤ 0 oder ein Budget, das keine ganze Zahl ist, zum Konfigurationsfehler in `sdd config validate`. CON-0190 zählt die Validierungsregeln abschließend auf (Pflichtfelder, Provider-Enum, Provider-Konsistenz); eine Budget-Regel fehlt.",
      "affected_specs": [],
      "required_action": "",
      "status": "resolved",
      "resolution": {
        "action": "CON-0225 INV-04 ergänzt CON-0190 um die Budget-Regel.",
        "resolved_at": "2026-09-27T13:01:21Z"
      }
    },
    {
      "id": "CF-0063-006",
      "type": "behavior-contradiction",
      "severity": "low",
      "new_contract": "CON-0225",
      "conflicting_contract": "CON-0191",
      "detail": "INV-04 verlangt beim Start Exit 2 für ein ungültiges Budget, gemeint ist `sdd pipeline run`. CON-0191 legt die Exit-Code-Semantik von `sdd config validate` fest. Unklar bleibt, ob `config validate` bei ungültigem Budget denselben Fehler-Exit liefert. Sonst kann ein Budget die Validierung bestehen und trotzdem den Run-Start mit Exit 2 abbrechen, oder umgekehrt.",
      "affected_specs": [],
      "required_action": "",
      "status": "resolved",
      "resolution": {
        "action": "CON-0225 INV-04: config validate nach CON-0191, pipeline run Exit 2.",
        "resolved_at": "2026-09-27T13:01:22Z"
      }
    },
    {
      "id": "CF-0063-007",
      "type": "scope-overlap",
      "severity": "low",
      "new_contract": "CON-0225",
      "conflicting_contract": "CON-0013",
      "detail": "INV-02 zählt Claude-Rollen im Modus `session` nicht zum Budget. Die Claude-Code-Subprocess-Sessions aus CON-0013 bleiben damit ohne Budget, obwohl `--max-claude-tokens` Claude-Verbrauch begrenzen soll. Die Ausnahme ist gewollt, sollte aber mit Verweis auf CON-0013 begründet werden. Sonst liest ein Nutzer `max_claude_tokens` als Obergrenze für den gesamten Claude-Verbrauch.",
      "affected_specs": [],
      "required_action": "",
      "status": "resolved",
      "resolution": {
        "action": "CON-0225 INV-02 begründet die Ausnahme mit CON-0207/CON-0013.",
        "resolved_at": "2026-09-27T13:01:23Z"
      }
    },
    {
      "id": "CF-0063-008",
      "type": "scope-overlap",
      "severity": "low",
      "new_contract": "CON-0226",
      "conflicting_contract": "CON-0064",
      "detail": "The e2e fixture brings its own `hidden/` directory, which the roles must not see during the run. CON-0064 (and CON-0009) already define holdout isolation for HOL artifacts. CON-0226 should either reuse that isolation mechanism or state explicitly that `hidden/` is bench-internal and not subject to HOL isolation. Otherwise there are two parallel isolation rules for hidden test material.",
      "affected_specs": [],
      "required_action": "",
      "status": "acknowledged",
      "resolution": {
        "action": "acknowledged",
        "reason": "hidden/ ist bench-intern (Fixture außerhalb des Arbeitsverzeichnisses) und kein HOL-Artefakt; CON-0226 INV-02/04.",
        "resolved_at": "2026-09-27T13:01:23Z"
      }
    },
    {
      "id": "CF-0063-009",
      "type": "scope-overlap",
      "severity": "low",
      "new_contract": "CON-0226",
      "conflicting_contract": "CON-0065",
      "detail": "INV-01 allows `isolation` as an option with the default `dir`. If a container variant is added later, it overlaps with the container lifecycle in CON-0065 and the runtime settings in CON-0072 (`docker.runtime`, `image`). The contract should state whether e2e runs reuse the existing container runtime from `config.yaml` or start containers of their own.",
      "affected_specs": [],
      "required_action": "",
      "status": "acknowledged",
      "resolution": {
        "action": "acknowledged",
        "reason": "Container-Isolation ist Nicht-Ziel; eine spätere Strategie nutzt dann den Dev-Container aus CON-0065.",
        "resolved_at": "2026-09-27T13:01:24Z"
      }
    },
    {
      "id": "CF-0063-010",
      "type": "dependency-gap",
      "severity": "medium",
      "new_contract": "CON-0226",
      "conflicting_contract": "CON-0016",
      "detail": "CON-0226 adds new suite fields: `kind: e2e`, `fixture`, `specs`, `test_command` with the placeholders `{python}` and `{junit}`, `weights` and `timeout_seconds`. None of the listed contracts covers the base schema for bench suites and reports from SPEC-0056, and CON-0016 only describes `config.yaml`. As a result, INV-01 extends a schema that has no contract reference. It should reference the SPEC-0056 bench contract, or bring its own schema if suites are not configured in `config.yaml`.",
      "affected_specs": [],
      "required_action": "",
      "status": "acknowledged",
      "resolution": {
        "action": "acknowledged",
        "reason": "Das Suite-Schema steht in CON-0221 (SPEC-0056); CON-0226 INV-01 erweitert es additiv.",
        "resolved_at": "2026-09-27T13:01:25Z"
      }
    }
  ],
  "impact_summary": {
    "total_conflicts": 10,
    "high": 0,
    "medium": 4,
    "low": 6,
    "affected_specs_count": 0
  }
}